Serial No,Type,District,Area,Dealer name,Mobile No,Address,NaPanta Mobile App
1,Seed Dealers,Kanpur City,Kalyanpur,ABHISHEK AGRO AGENCY,,81/79 DHAN KUTTI KANPUR BLOCK KALYANPUR,For Free Alerts
2,Seed Dealers,Kanpur City,Kalyanpur,ADVEY KRISAK SANGH KHAD AND BEEJ BHANDAR,,NAUBASTA BLOCK KALYANPUR,For Free Alerts
3,Seed Dealers,Kanpur City,Kalyanpur,AMAN KUMAR,,NAWAB GANJ KANPUR BLOCK KALYANPUR,For Free Alerts
4,Seed Dealers,Kanpur City,Kalyanpur,ANAND BEEJ BHANDAR,,SACHENDI KANPUR BLOCK KALYANPUR,For Free Alerts
5,Seed Dealers,Kanpur City,Kalyanpur,ANANNT ENTERPRISES,,SHOP NO 16 NAVSHEEL DHAM KALYANPUR KANPUR BLOCK KALYANPUR,For Free Alerts
6,Seed Dealers,Kanpur City,Kalyanpur,ANKUR SEEDS,,SABJI MANDI KANPUR BLOCK KALYANPUR,For Free Alerts
7,Seed Dealers,Kanpur City,Kalyanpur,ANKUR SEEDS FARM,,KALYANPUR KANPUR BLOCK KALYANPUR,For Free Alerts
8,Seed Dealers,Kanpur City,Kalyanpur,ANMOL KRISHI SEWA KENDRA,,NAWAB GANJ KANPUR BLOCK KALYANPUR,For Free Alerts
9,Seed Dealers,Kanpur City,Kalyanpur,ANNADESHWAR AGRO AGENCY,,DHANKUTTI KANPUR BLOCK KALYANPUR,For Free Alerts
10,Seed Dealers,Kanpur City,Kalyanpur,ANNPURANA SEEDS COMPANY,,DHAN KUTTI KANPUR BLOCK KALYAN PUR,For Free Alerts
11,Seed Dealers,Kanpur City,Kalyanpur,APARNA KISHAN SEWA KENDRA,,KISHAN NAGAR KANPUR BLOCK KALYANPUR,For Free Alerts
12,Seed Dealers,Kanpur City,Kalyanpur,ARJUN KRISHI SEWA KENDRA,,KISHAN NAGAR KANPUR BLOCK KALYANPUR,For Free Alerts
13,Seed Dealers,Kanpur City,Kalyanpur,ASHOK SEEDS,,75/213 SABJIMANDI KANPUR BLOCK KALYANPUR,For Free Alerts
14,Seed Dealers,Kanpur City,Kalyanpur,AWANTIKA BEEJ BHANDAR,,GRAM TIKRA KALYANPUR KANPUR BLOCK KALYANPUR,For Free Alerts
15,Seed Dealers,Kanpur City,Kalyanpur,AWASTHI SEED PVT LTD,,108 B POKHAR PURWA KANPUR BLOCK KALYANPUR,For Free Alerts
16,Seed Dealers,Kanpur City,Kalyanpur,CHOLA HYBRID SEEDS CO,,SHAKKAR PATTI KANPUR NAGAR BLOCK KALYANPUR,For Free Alerts
17,Seed Dealers,Kanpur City,Kalyanpur,DHAKA SEEDS,,AWADHPURI KALYANPUR KANPUR BLOCK KALYANPUR,For Free Alerts
18,Seed Dealers,Kanpur City,Kalyanpur,DISHA CROP CARE TECHONOLOGY,,127/14 A VINOBA NAGAR KANPUR BLOCK KALYANPUR,For Free Alerts
19,Seed Dealers,Kanpur City,Kalyanpur,DIVYANSHI BEEJ BHANDAR,,GRAM LOHARKHERA KALYANPUR KANPUR BLOCK KALYANPUR,For Free Alerts
20,Seed Dealers,Kanpur City,Kalyanpur,DWIVEDI BEEJ BHANDAR,,NAWAB GANJ KANPUR BLOCK KALYANPUR,For Free Alerts
21,Seed Dealers,Kanpur City,Kalyanpur,GANPATI BEEJ BHANDAR,,GANPAT NAGAR KALYANPUR KANPUR BLOCK KALYANPUR,For Free Alerts
22,Seed Dealers,Kanpur City,Kalyanpur,GAURAV AGRO AGENCY,,PACHOR ROAD MANDHNA KALYANPUR KANPUR BLOCK KALYANPUR,For Free Alerts
23,Seed Dealers,Kanpur City,Kalyanpur,GOPAL BEEJ COMPANY,,75/220 SABJI MANDI BADSAHI NAKA KANPUR BLOCK KALYANPUR,For Free Alerts
24,Seed Dealers,Kanpur City,Kalyanpur,GROWTH INDIA SEEDS PVT LTD,,GANPAT NAGAR GT ROAD KALYANPUR KANPUR BLOCK KALYANPUR,For Free Alerts
25,Seed Dealers,Kanpur City,Kalyanpur,HANS BEEJ BHANDAR,,BAJPAI NAGAR JAJMAU BLOCK KALYANPUR,For Free Alerts
26,Seed Dealers,Kanpur City,Kalyanpur,HARI OM PESTISIDES,,BITHOOR KANPUR BLOCK KALYANPUR,For Free Alerts
27,Seed Dealers,Kanpur City,Kalyanpur,HARYANA SEEDS,,KESWA GANJ DHARI KA PURWA KANPUR BLOCK KALYANPUR,For Free Alerts
28,Seed Dealers,Kanpur City,Kalyanpur,INDIAN PROLIFIC OF INPUTS,,LAKHANPUR KALYANPUR KANPUR BLOCK KALYANPUR,For Free Alerts
29,Seed Dealers,Kanpur City,Kalyanpur,JAGDISH BEEJ COMPANY,,75/242 BADSAHI NAKA KANPUR BLOCK KALYANPUR,For Free Alerts
30,Seed Dealers,Kanpur City,Kalyanpur,JAGMOHAN LAL AND CO,,DHANKUTTI KANPUR BLOCK KALYANPUR,For Free Alerts
31,Seed Dealers,Kanpur City,Kalyanpur,JAM JAM BEEJ COMPANY,,SABJI I MANDI KANPUR BLOCK KALYANPUR,For Free Alerts
32,Seed Dealers,Kanpur City,Kalyanpur,JAURALI BEEJ BHANDAR,,JAURALI KANPUR NAGAR BLOCK KALYANPUR,For Free Alerts
33,Seed Dealers,Kanpur City,Kalyanpur,JILA SAHKARI FEDRATION LTD,,NARAMAU KALYANPUR KANPUR BLOCK KALYANPUR,For Free Alerts
34,Seed Dealers,Kanpur City,Kalyanpur,KANPUR AGRO CENTER,,VINOBA NAGAR KANPUR BLOCK KALYANPUR,For Free Alerts
35,Seed Dealers,Kanpur City,Kalyanpur,KANPUR BEEJ BHANDAR,,RAWATPUR KANPUR BLOCK KALYANPUR,For Free Alerts
36,Seed Dealers,Kanpur City,Kalyanpur,KISHAN BEEJ BHANDAR,,KISHAN NAGAR KANPUR BLOCK KALYANPUR,For Free Alerts
37,Seed Dealers,Kanpur City,Kalyanpur,KISHAN BEEJ BHANDAR,,BITHOOR ROAD MANDHANA KALYANPUR KANPUR BLOCK KALYANPUR,For Free Alerts
38,Seed Dealers,Kanpur City,Kalyanpur,KISHAN BEEJ BHANDAR,,GRAM TATARPUR KALYANPUR KANPUR BLOCK KALYANPUR,For Free Alerts
39,Seed Dealers,Kanpur City,Kalyanpur,KISHAN BEEJ SHAKARI SAMITI,,AWADHPURI KANPUR BLOCK KALYANPUR,For Free Alerts
40,Seed Dealers,Kanpur City,Kalyanpur,KISHAN KRISHI KENDRA,,76/242 BADSAHI NAKA KANPUR BLOCK KALYANPUR,For Free Alerts
41,Seed Dealers,Kanpur City,Kalyanpur,KISHAN KRISHI SEWA KENDRA,,GRAM TIKRA KALYANPUR KANPUR BLOCK KALYANPUR,For Free Alerts
42,Seed Dealers,Kanpur City,Kalyanpur,KISHAN SEEDS AND PESTICIDE,,JHAKAR KATTI KANPUR BLOCK KALYANPUR,For Free Alerts
43,Seed Dealers,Kanpur City,Kalyanpur,KISHAN SEWA KENDRA,,GT ROAD KALYANPUR KANPUR BLOCK KALYANPUR,For Free Alerts
44,Seed Dealers,Kanpur City,Kalyanpur,KOYAL KHAD BHANDAR,,GRAM DOOL KALYANPUR KANPUR BLOCK KALYANPUR,For Free Alerts
45,Seed Dealers,Kanpur City,Kalyanpur,KRISHANA AGRO AGENCY,,DHANKUTTI KANPUR BLOCK KALYANPUR,For Free Alerts
46,Seed Dealers,Kanpur City,Kalyanpur,KRISHI SAHARA,,75/232 SABJIMANDI KANPUR BLOCK KALYAN PUR,For Free Alerts
47,Seed Dealers,Kanpur City,Kalyanpur,KRISI VIKAS KENDRA,,KIDWAI NAGAR KANPUR BLOCK KALYANPUR,For Free Alerts
48,Seed Dealers,Kanpur City,Kalyanpur,KUSHWAHA AGRO AGENCY,,SHOP 80 RAMA DEVI KANPUR BLOCK KALYANPUR,For Free Alerts
49,Seed Dealers,Kanpur City,Kalyanpur,MAA TAPESWARI BEEJ BHANDAR,,GRAM REWRI KALYANPUR KANPUR BLOCK KALYANPUR,For Free Alerts
50,Seed Dealers,Kanpur City,Kalyanpur,MAA TAPESWARI BEEJ BHANDAR,,GRAM REWRI KALYANPUR KANPUR BLOCK KALYANPUR,For Free Alerts
51,Seed Dealers,Kanpur City,Kalyanpur,MANGAL BEEJ BHANDAR,,GT ROAD KALYANPUR KANPUR BLOCK KALYANPUR,For Free Alerts
52,Seed Dealers,Kanpur City,Kalyanpur,MANGAL BEEJ BHANDAR,,GT ROAD KALYANPUR KANPUR BLOCK KALYANPUR,For Free Alerts
53,Seed Dealers,Kanpur City,Kalyanpur,MANOJ BEEJ COMPANY,,SABJI MANDI KANPUR BLOCK KALYANPUR,For Free Alerts
54,Seed Dealers,Kanpur City,Kalyanpur,MASTER BEEJ BHANDAR,,KISHAN NAGAR KANPUR BLOCK KALYANPUR,For Free Alerts
55,Seed Dealers,Kanpur City,Kalyanpur,MISHRA KHAD AND BEEJ BHANDAR,,GT ROAD MADHANA KANPUR BLOCK KALYANPUR,For Free Alerts
56,Seed Dealers,Kanpur City,Kalyanpur,Ms Sun Seeds,,87/8 Kanpur Tranari Compound Kalpi Road,For Free Alerts
57,Seed Dealers,Kanpur City,Kalyanpur,NATIONAL HORTI CULTURE AND DOUBLE FOUNDATION,,BARRA KANPUR BLOCK KALYANPUR,For Free Alerts
58,Seed Dealers,Kanpur City,Kalyanpur,NCF NAVEEN MARKERT,,KANPUR NAGAR BLOCK KALYANPUR,For Free Alerts
59,Seed Dealers,Kanpur City,Kalyanpur,NEW KATIYAR BEEJ BHANDAR,,MANDHANA KALYANPUR KANPUR BLOCK KALYANPUR,For Free Alerts
60,Seed Dealers,Kanpur City,Kalyanpur,NEW KRISAK BEEJ BHANDAR,,KISHAN NAGAR KALYANPUR KANPUR BLOCK KALYANPUR,For Free Alerts
61,Seed Dealers,Kanpur City,Kalyanpur,NEW KUSHWAHA BEEJ BHANDAR,,BITHOOR ROAD MANDHANA KALYANPUR KANPUR BLOCK KALYANPUR,For Free Alerts
62,Seed Dealers,Kanpur City,Kalyanpur,NEW MANJULA BEEJ BHANDAR,,RAWATPUR KANPUR BLOCK KALYANPUR,For Free Alerts
63,Seed Dealers,Kanpur City,Kalyanpur,NEW UTTAM BEEJ BHANDAR,,RAWATPUR STATION KANPUR BLOCK KALYANPUR,For Free Alerts
64,Seed Dealers,Kanpur City,Kalyanpur,OM BEEJ BHANDAR,,BARADEVI KANPUR BLOCK KALYANPUR,For Free Alerts
65,Seed Dealers,Kanpur City,Kalyanpur,OMAR AGENCY,,GARDIYAN PURWA KANPUR BLOCK KALYANPUR,For Free Alerts
66,Seed Dealers,Kanpur City,Kalyanpur,PAHUNA SEEDS,,114/63 VINAYAKPUR KALYANPUR KANPUR BLOCK KALYANPUR,For Free Alerts
67,Seed Dealers,Kanpur City,Kalyanpur,PAL KHAD AND BEEJ BHANDAR,,BHAUTI KANPUR BLOCK KALYANPUR,For Free Alerts
68,Seed Dealers,Kanpur City,Kalyanpur,PANDEY BEEJ BHANDAR,,GRAM TIKRA KALYANPUR KANPUR BLOCK KALYANPUR,For Free Alerts
69,Seed Dealers,Kanpur City,Kalyanpur,PANDEY BEEJ BHANDAR,,KISHAN NAGAR KANPUR BLOCK KALYANPUR,For Free Alerts
70,Seed Dealers,Kanpur City,Kalyanpur,PANDEY TRADERS,,KISHAN NAGAR KANPUR BLOCK KALYANPUR,For Free Alerts
71,Seed Dealers,Kanpur City,Kalyanpur,PANDIT AGRO AGENCY,,CHUNNI GANJ KANPUR BLOCK KALYANPUR,For Free Alerts
72,Seed Dealers,Kanpur City,Kalyanpur,PANDIT BEEJ BHANDAR,,RAWATPUR KANPUR BLOCK KALYANPUR,For Free Alerts
73,Seed Dealers,Kanpur City,Kalyanpur,PANKAJ SEEDS,,75/232 SABJI MANDI KANPUR BLOCK KALYANPUR,For Free Alerts
74,Seed Dealers,Kanpur City,Kalyanpur,PARAS AGRI SEEDS,,SABJI MANDI KANPUR BLOCK KALYANPUR,For Free Alerts
75,Seed Dealers,Kanpur City,Kalyanpur,PARIHAR TRADING COMPANY,,73/213 SABJI MANDI KANPUR BLOCK KALYANPUR,For Free Alerts
76,Seed Dealers,Kanpur City,Kalyanpur,PARKHAR AGRI GENTICS SEED,,VINAYAK PUR KANPUR BLOCK KALYANPUR,For Free Alerts
77,Seed Dealers,Kanpur City,Kalyanpur,PRAMOD SEEDS CORPORATION,,BHAUTI KANPUR BLOCK KALYANPUR,For Free Alerts
78,Seed Dealers,Kanpur City,Kalyanpur,PROGRESIV SEEDS,,HALSI ROAD KANPUR BLOCK KALYANPUR,For Free Alerts
79,Seed Dealers,Kanpur City,Kalyanpur,PURWAR PESTICIDE,,81/59 DHANN KUTTI KANPUR NAGAR BLOCK KALYANPUR,For Free Alerts
80,Seed Dealers,Kanpur City,Kalyanpur,PURWAR SEED COMPANY,,DHANKUTTI KANPUR BLOCK KALYANPUR,For Free Alerts
81,Seed Dealers,Kanpur City,Kalyanpur,R K TRADERS,,KALYANPUR KANPUR BLOCK KALYANPUR,For Free Alerts
82,Seed Dealers,Kanpur City,Kalyanpur,RADHEY BEEJ BHANDAR,,BITHOOR KALYANPUR KANPUR BLOCK KALYANPUR,For Free Alerts
83,Seed Dealers,Kanpur City,Kalyanpur,RAHUL KHAD BHANDAR,,SINGHPUR KALYANPUR KANPUR BLOCK KALYANPUR,For Free Alerts
84,Seed Dealers,Kanpur City,Kalyanpur,RAJENDRA KUMAR AND CO,,HALSI ROAD KANPUR BLOCK KALYANPUR,For Free Alerts
85,Seed Dealers,Kanpur City,Kalyanpur,RAM AUTAR SINGH AND SONS,,32 BADA LAKHANPUR KALYANPUR KANPUR BLOCK KALYANPUR,For Free Alerts
86,Seed Dealers,Kanpur City,Kalyanpur,RAM KRISHNA BEEJ BHANDAR,,BARADEVI KANPUR BLOCK KALYANPUR,For Free Alerts
87,Seed Dealers,Kanpur City,Kalyanpur,RANA JI BIOTECH INDIA LTD,,VINOBA NAGAR KANPUR BLOCK KALYANPUR,For Free Alerts
88,Seed Dealers,Kanpur City,Kalyanpur,RASHI TRADERS,,75/232 SABJI MANDI KANPUR BLOCK KALYANPUR,For Free Alerts
89,Seed Dealers,Kanpur City,Kalyanpur,RIYA AGRI GENTICS,,SHOP 32 TATMIL KANPUR BLOCK KALYANPUR,For Free Alerts
90,Seed Dealers,Kanpur City,Kalyanpur,SAI AGRI BUSINESS,,DHANKUTTI KANPUR BLOCK KALYANPUR,For Free Alerts
91,Seed Dealers,Kanpur City,Kalyanpur,SAI AGRI BUSINESS,,DHANKUTTI KANPUR BLOCK KALYANPUR,For Free Alerts
92,Seed Dealers,Kanpur City,Kalyanpur,SAI RAM BEEJ BHANDAR,,GRAM DOOL KALYANPUR KANPUR BLOCK KALYANPUR,For Free Alerts
93,Seed Dealers,Kanpur City,Kalyanpur,SANIK AGRO AGENCY,,GRAM TIKRA KALYANPUR KANPUR BLOCK KALYANPUR,For Free Alerts
94,Seed Dealers,Kanpur City,Kalyanpur,SANIK AGRO AGENCY,,GRAM TIKRA KALYANPUR KANPUR BLOCK KALYANPUR,For Free Alerts
95,Seed Dealers,Kanpur City,Kalyanpur,SANIK TRADERS,,75/232 SABJI MANDI KANPUR BLOCK KALYANPUR,For Free Alerts
96,Seed Dealers,Kanpur City,Kalyanpur,SEEMA SEEDS AND BIOTECH,,AZAD NAGAR KALYANPUR KANPUR BLOCK KALYANPUR,For Free Alerts
97,Seed Dealers,Kanpur City,Kalyanpur,SEEMA SEEDS AND BIOTECH,,37 A(1) NEW AZAD NAGER KALYANPUR,For Free Alerts
98,Seed Dealers,Kanpur City,Kalyanpur,SHANKAR AGRO AGENCY,,DHAN KUTTI KANPUR BLOCK KALYAN PUR,For Free Alerts
99,Seed Dealers,Kanpur City,Kalyanpur,SHIV BHOLA BEEJ BHANDAR,,TAUDHAKPUR ROAD GALLA MANDI NAUBSTA.BLOCK KALAYANPUR,For Free Alerts
100,Seed Dealers,Kanpur City,Kalyanpur,SHRADHHA AGRO AGENCY,,81/57 DHANN KUTTI KANPUR NAGAR BLOCK KALYANPUR,For Free Alerts
101,Seed Dealers,Kanpur City,Kalyanpur,SHRI KRISHNA ENTERPRISES,,SABJI MANDI KANPUR BLOCK KALYANPUR,For Free Alerts
102,Seed Dealers,Kanpur City,Kalyanpur,SHUBHAM SEEDS,,75/213 RANJIT PURWA KANPUR BLOCK KALYANPUR,For Free Alerts
103,Seed Dealers,Kanpur City,Kalyanpur,SHUKLA ENTERPRISES,,GRAM TIKRA KALYANPUR KANPUR BLOCK KALYANPUR,For Free Alerts
104,Seed Dealers,Kanpur City,Kalyanpur,SHUKLA SEED COMPANY,,50/275 HALSI ROAD KANPUR BLOCK KALYANPUR,For Free Alerts
105,Seed Dealers,Kanpur City,Kalyanpur,SINGH BEEJ BHANDAR,,GRAM KAINDHA KANPUR BLOCK KALYANPUR,For Free Alerts
106,Seed Dealers,Kanpur City,Kalyanpur,SONU BEEJ BHANDAR,,SHIVLI ROAD TIKRA KALYANPUR KANPUR BLOCK KALYANPUR,For Free Alerts
107,Seed Dealers,Kanpur City,Kalyanpur,SUN SEEDS,,87/8 KALPI ROAD KANPUR BLOCK KALYANPUR,For Free Alerts
108,Seed Dealers,Kanpur City,Kalyanpur,SURYA UDHYOG,,314 MEERPUR CHAWANI KANPUR. BLOCK KALAYANPUR,For Free Alerts
109,Seed Dealers,Kanpur City,Kalyanpur,SWDESHI SEEDS COMPANY,,SABJI MANDI KANPUR BLOCK KALYANPUR,For Free Alerts
110,Seed Dealers,Kanpur City,Kalyanpur,UP AGRO AGENCY,,DHANKUTTI KANPUR BLOCK KALYANPUR,For Free Alerts
111,Seed Dealers,Kanpur City,Kalyanpur,UP CO OPERATIVE FEDRATION LTD,,C 39 PANKI KANPUR BLOCK KALYANPUR,For Free Alerts
112,Seed Dealers,Kanpur City,Kalyanpur,UPKAR BEEJ BHANDAR,,75/232 SABJIMANDI KANPUR BLOCK KALYAN PUR,For Free Alerts
113,Seed Dealers,Kanpur City,Kalyanpur,VAISNO AGRO TRADERS,,SABJI MANDI KANPUR BLOCK KALYANPUR,For Free Alerts
114,Seed Dealers,Kanpur City,Kalyanpur,VIDHYA GRAMODHYOG SANSTHAN,,KOYALA NAGAR KANPUR BLOCK KALYANPUR,For Free Alerts
115,Seed Dealers,Kanpur City,Kalyanpur,VIJAY BEEJ BHANDAR,,DWIVEDI NAGAR GALLA MANDI NAUBASTA KANPUR BLOCK KALYANPUR,For Free Alerts
116,Seed Dealers,Kanpur City,Kalyanpur,VINAYAK SEEDS,,75/232 SABJIMANDI KANPUR BLOCK KALYAN PUR,For Free Alerts
